{
  "latitude": 52.52,
  "longitude": 13.419998,
  "generationtime_ms": 0.08797645568847656,
  "utc_offset_seconds": 0,
  "timezone": "GMT",
  "timezone_abbreviation": "GMT",
  "elevation": 38.0,
  "hourly_units": {
    "time": "iso8601",
    "temperature_2m": "°C",
    "relative_humidity_2m": "%",
    "precipitation": "mm",
    "wind_speed_10m": "km/h",
    "wind_direction_10m": "°",
    "weather_code": "wmo code"
  },
  "hourly": {
    "time": [
      "2024-01-15T00:00",
      "2024-01-15T01:00",
      "2024-01-15T02:00",
      "2024-01-15T03:00"
    ],
    "temperature_2m": [3.2, 2.8, 2.5, 2.1],
    "relative_humidity_2m": [82, 84, 85, 86],
    "precipitation": [0.0, 0.0, 0.1, 0.2],
    "wind_speed_10m": [14.2, 13.5, 12.8, 11.9],
    "wind_direction_10m": [245, 248, 251, 255],
    "weather_code": [3, 3, 61, 61]
  }
}
