{
  "latitude": 52.52,
  "longitude": 13.41,
  "generationtime_ms": 0.1220703125,
  "utc_offset_seconds": 0,
  "timezone": "GMT",
  "timezone_abbreviation": "GMT",
  "elevation": 38.0,
  "hourly_units": {
    "time": "iso8601",
    "pm10": "μg/m³",
    "pm2_5": "μg/m³",
    "carbon_monoxide": "μg/m³",
    "nitrogen_dioxide": "μg/m³",
    "ozone": "μg/m³",
    "uv_index": "",
    "european_aqi": "EAQI",
    "us_aqi": "USAQI"
  },
  "hourly": {
    "time": [
      "2024-01-15T00:00",
      "2024-01-15T01:00",
      "2024-01-15T02:00",
      "2024-01-15T03:00"
    ],
    "pm10": [18.5, 19.2, 20.1, 18.8],
    "pm2_5": [10.2, 10.8, 11.3, 10.5],
    "carbon_monoxide": [248.0, 252.0, 259.0, 245.0],
    "nitrogen_dioxide": [15.3, 14.8, 14.2, 13.9],
    "ozone": [62.4, 60.1, 58.7, 57.2],
    "uv_index": [0.0, 0.0, 0.0, 0.0],
    "european_aqi": [28, 29, 30, 28],
    "us_aqi": [45, 47, 49, 45]
  }
}
